news_headline,news_article,news_category,full_text,clean_text
4 women killed every day in Brazil this year: Report,"Four women have been killed every day so far this year in Brazil, the Inter-American Commission on Human Rights (IACHR) said. IACHR called the rate ""alarming"" and called upon the Brazilian government to take more steps to prevent and prosecute femicides. Femicide is the killing of a woman by a man because of her gender.",world,"4 women killed every day in Brazil this year: Report. Four women have been killed every day so far this year in Brazil, the Inter-American Commission on Human Rights (IACHR) said. IACHR called the rate ""alarming"" and called upon the Brazilian government to take more steps to prevent and prosecute femicides. Femicide is the killing of a woman by a man because of her gender.",4 woman kill everi day brazil thi year report four woman kill everi day far thi year brazil interamerican commiss human right iachr say iachr call rate alarm call upon brazilian govern take step prevent prosecut femicid femicid kill woman man becaus gender
4th person dies in 'menstruation hut' in Nepal this year,"A 21-year-old woman has become the fourth person to die in Nepal this year after she was forced to stay in a 'menstruation hut' during her period under the practice of chhaupadi. She died due to smoke inhalation and suffocation as she closed the door of the windowless hut and lit a fire for warmth during the night, authorities said.",world,"4th person dies in 'menstruation hut' in Nepal this year. A 21-year-old woman has become the fourth person to die in Nepal this year after she was forced to stay in a 'menstruation hut' during her period under the practice of chhaupadi. She died due to smoke inhalation and suffocation as she closed the door of the windowless hut and lit a fire for warmth during the night, authorities said.",4th person die menstruat hut nepal thi year 21yearold woman ha becom fourth person die nepal thi year wa forc stay menstruat hut dure period practic chhaupadi die due smoke inhal suffoc close door windowless hut light fire warmth dure night author say
Saudi gave US-made weapons to al-Qaeda-linked groups: Report,"Saudi Arabia and the UAE transferred US-made weapons to al-Qaeda-linked groups, hardline Salafi militias, and other factions fighting the war in Yemen, according to a CNN report. The Saudi-led coalition used US-manufactured weapons ""as a form of currency to buy the loyalties of militias"", the report added. Iran-backed Houthi rebels got hold of US-made Mine Resistant Ambush Protected vehicles.",world,"Saudi gave US-made weapons to al-Qaeda-linked groups: Report. Saudi Arabia and the UAE transferred US-made weapons to al-Qaeda-linked groups, hardline Salafi militias, and other factions fighting the war in Yemen, according to a CNN report. The Saudi-led coalition used US-manufactured weapons ""as a form of currency to buy the loyalties of militias"", the report added. Iran-backed Houthi rebels got hold of US-made Mine Resistant Ambush Protected vehicles.",saudi give usmad weapon alqaedalink group report saudi arabia uae transfer usmad weapon alqaedalink group hardlin salafi militia faction fight war yeman accord cnn report saudil coalit use usmanufactur weapon form currenc buy loyalti militia report ad iranback houthi rebel get hold usmad mine resist ambush protect vehicl
"China, Taiwan clash with propaganda videos on Lunar New Year","China and Taiwan marked the Lunar New Year by releasing videos showing their military capabilities, in the latest clash between the two. China released a video showing its jets and bombers flying against images of Taiwan's scenery, with the background lyrics calling upon ""brothers and sisters"" to ""return"". In response, Taiwan's military released a video, titled 'Freedom Is Not Free'. ",world,"China, Taiwan clash with propaganda videos on Lunar New Year. China and Taiwan marked the Lunar New Year by releasing videos showing their military capabilities, in the latest clash between the two. China released a video showing its jets and bombers flying against images of Taiwan's scenery, with the background lyrics calling upon ""brothers and sisters"" to ""return"". In response, Taiwan's military released a video, titled 'Freedom Is Not Free'. ",china taiwan clash propaganda video lunar new year china taiwan mark lunar new year releas video show militari capabl late clash two china releas video show jet bomber fli imag taiwan sceneri background lyric call upon brother sister return respon taiwan militari relea video titl freedom not free
Ivanka responds to art exhibit showing her vacuuming crumbs,"Responding to an art exhibit showing her lookalike vacuuming crumbs, US President Donald Trump's daughter Ivanka Trump tweeted, ""Women can choose to knock each other down or build each other up. I choose the latter."" Ivanka is ""a figure whose public persona incorporates an almost comically wide range of feminine identities– daughter, wife, mother...working woman,"" the exhibit's description read.",world,"Ivanka responds to art exhibit showing her vacuuming crumbs. Responding to an art exhibit showing her lookalike vacuuming crumbs, US President Donald Trump's daughter Ivanka Trump tweeted, ""Women can choose to knock each other down or build each other up. I choose the latter."" Ivanka is ""a figure whose public persona incorporates an almost comically wide range of feminine identities– daughter, wife, mother...working woman,"" the exhibit's description read.",ivanka respond art exhibit show vacuum crumb respond art exhibit show lookalik vacuum crumb us presid donald trump daughter ivanka trump tweet woman choo knock build choo latter ivanka figur whose public persona incorpor almost comic wide rang feminin ident daughter wife motherwork woman exhibit descript read
Will build a human wall at Mexico border if necessary: Trump,"US President Donald Trump on Tuesday said that his country will build a 'human wall' along the border with Mexico if necessary by deploying troops to the border. His remarks come after the US announced last week that 3,750 additional soldiers were being sent to the Mexico border, bringing the total number to over 4,300. ",world,"Will build a human wall at Mexico border if necessary: Trump. US President Donald Trump on Tuesday said that his country will build a 'human wall' along the border with Mexico if necessary by deploying troops to the border. His remarks come after the US announced last week that 3,750 additional soldiers were being sent to the Mexico border, bringing the total number to over 4,300. ",build human wall mexico border necessari trump us presid donald trump tuesday say hi countri build human wall along border mexico necessari deploy troop border hi remark come us announc last week 3750 addit soldier send mexico border bring total number 4300
Woman arrested for starting fire in Paris building that killed 10,"French authorities have arrested a 40-year-old woman over suspicions of starting a fire in an eight-storey building in Paris, killing at least 10 people and injuring over 30 others. The woman, who is known to have had mental health issues, allegedly started the fire following an argument with her neighbour who is a professional fireman.",world,"Woman arrested for starting fire in Paris building that killed 10. French authorities have arrested a 40-year-old woman over suspicions of starting a fire in an eight-storey building in Paris, killing at least 10 people and injuring over 30 others. The woman, who is known to have had mental health issues, allegedly started the fire following an argument with her neighbour who is a professional fireman.",woman arrest start fire pari build kill 10 french author arrest 40yearold woman suspicion start fire eightstorey build pari kill least 10 peopl injur 30 woman know mental health issu allegedli start fire follow argument neighbour profession fireman
Russia to develop new missile systems after nuclear treaty exit,"Russia has said it is planning to develop new missile systems by 2021 after both Russia and the US suspended their involvement in the Intermediate-Range Nuclear Forces Treaty which banned both countries from stationing short and intermediate-range, land-based missiles in Europe. After suspending the treaty last week, Russia has said it'll exit the deal in six months, following the US.",world,"Russia to develop new missile systems after nuclear treaty exit. Russia has said it is planning to develop new missile systems by 2021 after both Russia and the US suspended their involvement in the Intermediate-Range Nuclear Forces Treaty which banned both countries from stationing short and intermediate-range, land-based missiles in Europe. After suspending the treaty last week, Russia has said it'll exit the deal in six months, following the US.",russia develop new missil system nuclear treati exit russia ha say plan develop new missil system 2021 russia us suspend involv intermediaterang nuclear forc treati ban countri station short intermediaterang landbas missil europ suspend treati last week russia ha say exit deal six month follow us
